<?xml version="1.0"?>
<!-- Copyright (C) 2007-2024 Free Software Foundation, Inc.

     Copying and distribution of this file, with or without modification,
     are permitted in any medium without royalty provided the copyright
     notice and this notice are preserved.  -->

<!DOCTYPE feature SYSTEM "gdb-target.dtd">
<feature name="org.gnu.gdb.arm.core">
  <flags id="arm_cpsr" size="4">
    <field name="M" start="0" end="4"/>
    <field name="T" start="5" end="5"/>
    <field name="F" start="6" end="6"/>
    <field name="I" start="7" end="7"/>
    <field name="A" start="8" end="8"/>
    <field name="E" start="9" end="9"/>
    <field name="IT72" start="10" end="15"/>
    <field name="GE" start="16" end="19"/>
    <field name="J" start="24" end="24"/>
    <field name="IT10" start="25" end="26"/>
    <field name="Q" start="27" end="27"/>
    <field name="V" start="28" end="28"/>
    <field name="C" start="29" end="29"/>
    <field name="Z" start="30" end="30"/>
    <field name="N" start="31" end="31"/>
  </flags>
  <reg name="r0" bitsize="32" type="uint32"/>
  <reg name="r1" bitsize="32" type="uint32"/>
  <reg name="r2" bitsize="32" type="uint32"/>
  <reg name="r3" bitsize="32" type="uint32"/>
  <reg name="r4" bitsize="32" type="uint32"/>
  <reg name="r5" bitsize="32" type="uint32"/>
  <reg name="r6" bitsize="32" type="uint32"/>
  <reg name="r7" bitsize="32" type="uint32"/>
  <reg name="r8" bitsize="32" type="uint32"/>
  <reg name="r9" bitsize="32" type="uint32"/>
  <reg name="r10" bitsize="32" type="uint32"/>
  <reg name="r11" bitsize="32" type="uint32"/>
  <reg name="r12" bitsize="32" type="uint32"/>
  <reg name="sp" bitsize="32" type="data_ptr"/>
  <reg name="lr" bitsize="32"/>
  <reg name="pc" bitsize="32" type="code_ptr"/>

  <!-- The CPSR is register 25, rather than register 16, because
       the FPA registers historically were placed between the PC
       and the CPSR in the "g" packet.  -->
  <reg name="cpsr" bitsize="32" regnum="25" type="arm_cpsr"/>
</feature>
